<?xml version="1.0" encoding="UTF-8"?>
<alumno
    xmlns:xsi="http://www.w3.org/2001/XMLSchema-instance"
    xsi:noNamespaceSchemaLocation="alumno.xsd">
    <nombre>Juan Garcia</nombre>
    <direccion>
        <calle>Avenida de la Fuente</calle>
        <numero>6</numero>
        <ciudad>Zafra</ciudad>
        <provincia>Badajoz</provincia>
    </direccion>
    <telefono>666666666</telefono>
    <telefeno>999999999</telefeno>
</alumno>